{
  "$schema": "https://raw.githubusercontent.com/mitsuhiko/pi-ds4/main/settings.schema.json",
  "protocol": "openai-responses",
  "apiKey": "dsv4-local",
  "supportRepo": "https://github.com/antirez/ds4",
  "supportBranch": "main",
  "runtimeDir": null,
  "autoUpdate": true,
  "contextTokens": 393216,
  "power": 100,
  "ssdStreaming": "auto",
  "readyTimeoutMs": 600000,
  "serverBinary": null,
  "watchdogScript": null
}
